{
  "$schema": "./server-dependency.schema.json",
  "schema_version": "1.0.0",
  "manifest_revision": "2026-09-21",
  "server_id": "nextops-app",
  "evidence_status": "planning_contract_not_deployed",
  "purpose": "Serve the local bilingual UI and authenticated API, run durable application workers and audit, and host the initial restricted NextOps PostgreSQL service until the approved database split.",
  "authorization": {
    "documentation_authorized": true,
    "provisioning_authorized": false,
    "operational_access_authorized": false,
    "destructive_actions_authorized": false,
    "notes": "The owner authorized this deployment dossier and accepted Phase 0. VM creation, installation, private network access, database initialization, and service changes still require a separate approved change window."
  },
  "source_records": [
    "docs/requirements/HARDWARE_BASELINE.json",
    "docs/requirements/ZABBIX_SERVER_PLAN.json",
    "docs/en/SERVER_PLAN.md",
    "docs/en/ARCHITECTURE.md",
    "docs/en/CONFIGURATION.md",
    "docs/en/OFFLINE_RUNTIME.md",
    "docs/PROJECT_STATE.md"
  ],
  "vm": {
    "hypervisor": "VMware ESXi 8.0.3 build 24414501 (owner-supplied host evidence)",
    "guest_os": "Ubuntu Server 24.04 LTS proposed; exact image and maintained patch lock required",
    "vcpu": 8,
    "ram_gib": 32,
    "disk_gib": 200,
    "firmware": null,
    "cpu_hot_add": null,
    "proposed_datastore_alias": "DS-C",
    "placement_status": "Capacity-based proposal only; no reservation or VM exists by evidence in this repository.",
    "deployment_order": "1 of the three NextOps VMs; complete the private ESXi/storage/network preflight before creation",
    "preflight_requirements": [
      "Refresh DS-C free space and reconcile any already-created VM before subtracting capacity.",
      "Confirm available CPU/RAM, reservations, contention, VM compatibility level, guest features, and ESXi swap placement.",
      "Confirm backing-storage health/latency, thin-disk commitments, snapshot/consolidation space, and the approximately 900-GiB DS-C free-space target.",
      "Confirm approved local DNS, time, TLS, administrator recovery, and independent backup routes.",
      "Keep ESXi intact; do not install NextOps in the ESXi management shell."
    ]
  },
  "service_accounts": [
    {
      "id": "nextops-api",
      "scope": "API and application orchestration only; no target credentials or direct management-LAN route",
      "login": false,
      "privilege": "non-root service identity with read-only release/config access and only required state paths",
      "status": "planned_not_created"
    },
    {
      "id": "nextops-worker",
      "scope": "durable jobs, evidence processing, and append-restricted audit through application interfaces",
      "login": false,
      "privilege": "non-root service identity; no policy bypass, container socket, or target credentials",
      "status": "planned_not_created"
    },
    {
      "id": "postgres",
      "scope": "local NextOps PostgreSQL engine only",
      "login": false,
      "privilege": "database service identity; separate migration, runtime, audit, and backup roles required",
      "status": "planned_not_created"
    },
    {
      "id": "nginx",
      "scope": "TLS termination and local static UI only",
      "login": false,
      "privilege": "read-only static assets and certificate access; proxy only to the local API",
      "status": "planned_not_created"
    }
  ],
  "software_dependencies": [
    {
      "id": "ubuntu-server",
      "kind": "guest_os",
      "version": "24.04 LTS maintained patch (exact image pending)",
      "runtime_location": "local",
      "required": true,
      "status": "proposed_not_installed",
      "lock_evidence": null
    },
    {
      "id": "python",
      "kind": "runtime",
      "version": ">=3.12,<3.13",
      "runtime_location": "local",
      "required": true,
      "status": "locked_for_current_stage_1a_source_only",
      "lock_evidence": "pyproject.toml and uv.lock"
    },
    {
      "id": "nextops-python-package",
      "kind": "application",
      "version": "0.1.0 source metadata; no production release artifact",
      "runtime_location": "local",
      "required": true,
      "status": "contracts_and_policy_only_not_deployable",
      "lock_evidence": "pyproject.toml and uv.lock"
    },
    {
      "id": "pydantic",
      "kind": "python_dependency",
      "version": ">=2.10,<3",
      "runtime_location": "local",
      "required": true,
      "status": "locked_for_stage_1a",
      "lock_evidence": "uv.lock"
    },
    {
      "id": "fastapi-server-stack",
      "kind": "application_runtime",
      "version": null,
      "runtime_location": "local",
      "required": true,
      "status": "proposed_not_added_or_locked",
      "lock_evidence": null
    },
    {
      "id": "postgresql",
      "kind": "database",
      "version": "16 proposed; maintained patch lock pending",
      "runtime_location": "local",
      "required": true,
      "status": "proposed_not_installed",
      "lock_evidence": null
    },
    {
      "id": "sqlalchemy-alembic",
      "kind": "database_client_and_migrations",
      "version": null,
      "runtime_location": "local",
      "required": true,
      "status": "proposed_not_added_or_locked",
      "lock_evidence": null
    },
    {
      "id": "nginx",
      "kind": "reverse_proxy",
      "version": null,
      "runtime_location": "local",
      "required": true,
      "status": "proposed_not_locked",
      "lock_evidence": null
    },
    {
      "id": "nextops-static-ui",
      "kind": "frontend_bundle",
      "version": null,
      "runtime_location": "local",
      "required": true,
      "status": "proposed_not_implemented_or_built",
      "lock_evidence": null
    },
    {
      "id": "local-dns-time-pki",
      "kind": "infrastructure_service",
      "version": null,
      "runtime_location": "approved_lan",
      "required": true,
      "status": "private_input_not_verified",
      "lock_evidence": null
    },
    {
      "id": "independent-backup-target",
      "kind": "recovery_service",
      "version": null,
      "runtime_location": "approved_lan",
      "required": true,
      "status": "production_gate_not_selected",
      "lock_evidence": null
    }
  ],
  "artifacts": [
    {
      "id": "nextops-app-release",
      "purpose": "Signed or otherwise authenticated application release containing API, worker, migrations, and local documentation assets",
      "install_path": "/srv/nextops/releases/<release-id>",
      "version": null,
      "sha256": null,
      "license_record": null,
      "source_record": null,
      "status": "not_built"
    },
    {
      "id": "nextops-python-offline-dependencies",
      "purpose": "Complete locked wheel or image set for an offline clean install",
      "install_path": "/srv/nextops/artifacts/python",
      "version": null,
      "sha256": null,
      "license_record": null,
      "source_record": null,
      "status": "not_prepared"
    },
    {
      "id": "nextops-static-ui-bundle",
      "purpose": "Built Persian/English browser assets with no CDN or Internet runtime dependency",
      "install_path": "/srv/nextops/releases/<release-id>/static",
      "version": null,
      "sha256": null,
      "license_record": null,
      "source_record": null,
      "status": "not_built"
    },
    {
      "id": "database-migration-set",
      "purpose": "Reviewed forward and recovery migrations for durable identity, run, evidence, and audit state",
      "install_path": "/srv/nextops/releases/<release-id>/migrations",
      "version": null,
      "sha256": null,
      "license_record": null,
      "source_record": null,
      "status": "not_implemented"
    },
    {
      "id": "tls-public-chain",
      "purpose": "Local trust chain and public certificate material; the private key is delivered separately",
      "install_path": "/etc/nextops/tls",
      "version": null,
      "sha256": null,
      "license_record": "not_applicable",
      "source_record": null,
      "status": "private_pki_input_missing"
    }
  ],
  "configuration_files": [
    {
      "id": "app-config",
      "path": "/etc/nextops/app.yaml",
      "owner": "root:nextops-api",
      "mode": "0640",
      "contains_secret_values": false,
      "status": "planned_no_runtime_parser_or_example_file_yet",
      "required_settings": [
        "organization and environment IDs",
        "local service endpoints",
        "language and UTC/display-time settings",
        "durable data/evidence paths",
        "request, queue, timeout, and output limits"
      ]
    },
    {
      "id": "inventory-config",
      "path": "/etc/nextops/inventory.yaml",
      "owner": "root:nextops-api",
      "mode": "0640",
      "contains_secret_values": false,
      "status": "planned_no_runtime_parser_or_example_file_yet",
      "required_settings": [
        "immutable target IDs and organization/environment scope",
        "approved endpoint references without credentials",
        "target type, owner, tags, and last-verification time"
      ]
    },
    {
      "id": "credential-reference-config",
      "path": "/etc/nextops/credentials.yaml",
      "owner": "root:nextops-api",
      "mode": "0640",
      "contains_secret_values": false,
      "status": "planned_reference_only_no_runtime_parser_yet",
      "required_settings": [
        "opaque secret reference IDs only",
        "consumer identity and rotation metadata",
        "no password, token, private key, or decrypting key"
      ]
    },
    {
      "id": "policy-config",
      "path": "/etc/nextops/policies.yaml",
      "owner": "root:nextops-api",
      "mode": "0640",
      "contains_secret_values": false,
      "status": "planned_external_policy_format_not_implemented",
      "required_settings": [
        "deny-by-default organization/environment/target/action/scope rules",
        "Phase 1 READ_ONLY risk restriction",